book_code;title;author;year;udk;description;publisher;pages;isbn
BK0001;Евгений Онегин;Пушкин А.С.;1833;84(2Рус);Роман в стихах, одно из самых значительных произведений русской литературы;Издательство «Просвещение»;350;978-5-0001-0001-1
BK0002;Война и мир;Толстой Л.Н.;1869;84(2Рус);Роман-эпопея о русском обществе в эпоху войн против Наполеона;Издательство «Просвещение»;1225;978-5-0002-0002-2
BK0003;Преступление и наказание;Достоевский Ф.М.;1866;84(2Рус);Социально-психологический и философский роман;Издательство «Просвещение»;672;978-5-0003-0003-3
BK0004;Мёртвые души;Гоголь Н.В.;1842;84(2Рус);Поэма о похождениях Чичикова;Издательство «Просвещение»;432;978-5-0004-0004-4
BK0005;Мастер и Маргарита;Булгаков М.А.;1967;84(2Рус);Роман о визите дьявола в Москву;Издательство «Просвещение»;480;978-5-0005-0005-5
